{
  "kararlar": [
    {
      "id": "k1",
      "title": "Ankara 4. Ağır Ceza Mahkemesi 2016/232 Gerekçeli Karar",
      "filename": "ANKARA 4 AĞIR CEZA MAH 2016 232 GEREKÇELİ KARAR.pdf",
      "description": "2016 yılında Ankara 4. Ağır Ceza Mahkemesi tarafından verilen gerekçeli karar.",
      "category": "Mahkeme Kararı",
      "date": "2016",
      "size": "68MB",
      "localPath": "/kararlar/ANKARA 4 AĞIR CEZA MAH 2016 232 GEREKÇELİ KARAR.pdf",
      "googleDriveLink": "https://drive.google.com/file/d/1S046BdL1-52trjWTw4mlciAwN3_jcTrn/view?usp=share_link",
      "isOptimized": false
    },
    {
      "id": "k2", 
      "title": "Ankara 4. Ağır Ceza Mahkemesi 2018/287 Gerekçeli Karar",
      "filename": "ANKARA 4 AĞIR CEZA MAH 2018 287 GEREKÇELİ KARAR.pdf",
      "description": "2018 yılında Ankara 4. Ağır Ceza Mahkemesi tarafından verilen gerekçeli karar.",
      "category": "Mahkeme Kararı",
      "date": "2018",
      "size": "88MB",
      "localPath": "/kararlar/ANKARA 4 AĞIR CEZA MAH 2018 287 GEREKÇELİ KARAR.pdf",
      "googleDriveLink": "https://drive.google.com/file/d/1KnmsDJ9wzSnKvgHTJQ8w1VFmQdl9N6v9/view?usp=share_link",
      "isOptimized": false
    },
    {
      "id": "k3",
      "title": "Ankara Bölge Adliye Mahkemesi Gerekçeli Karar",
      "filename": "ANKARA BÖLGE ADLİYE MAHKEMESİ GEREKÇELİ KARAR.pdf",
      "description": "Ankara Bölge Adliye Mahkemesi tarafından verilen gerekçeli karar.",
      "category": "Mahkeme Kararı",
      "date": "2018",
      "size": "8.6MB",
      "localPath": "/kararlar/ANKARA BÖLGE ADLİYE MAHKEMESİ GEREKÇELİ KARAR.pdf",
      "googleDriveLink": "https://drive.google.com/file/d/1KnmsDJ9wzSnKvgHTJQ8w1VFmQdl9N6v9/view?usp=share_link",
      "isOptimized": false
    },
    {
      "id": "k4",
      "title": "İddianame",
      "filename": "İDDİANAME.pdf",
      "description": "Dava sürecinde hazırlanan iddianame belgesi.",
      "category": "Dava Belgesi",
      "date": "2015",
      "size": "58MB",
      "localPath": "/kararlar/İDDİANAME.pdf",
      "googleDriveLink": "https://drive.google.com/file/d/1KnmsDJ9wzSnKvgHTJQ8w1VFmQdl9N6v9/view?usp=share_link",
      "isOptimized": false
    }
  ],
  "belgeler_raporlar": [
    {
      "id": "b1",
      "title": "EGM Mülkiye Müfetişleri Araştırma Raporu",
      "filename": "1-Araştırma Raporu.pdf",
      "description": "10 Ekim Ankara Gar Katliamı ile ilgili detaylı araştırma raporu. Tarih: 24.02.2017",
      "category": "Araştırma",
      "date": "2017-02-24",
      "size": "2.3MB",
      "localPath": "/belgeler-raporlar/1-Araştırma Raporu.pdf",
      "googleDriveLink": "https://drive.google.com/file/d/1kf3qwsKZmox_N09fwxpO62ceKikNJhcX/view?usp=share_link",
      "isOptimized": false
    },
    {
      "id": "b2",
      "title": "EGM Mülkiye Müfetişleri Araştırma Raporu Ekleri",
      "filename": "2-Araştırma Raporu Ekleri .pdf",
      "description": "Araştırma raporuna ait ek belgeler ve dokümanlar.",
      "category": "Araştırma",
      "date": "2017-02-24",
      "size": "18MB",
      "localPath": "/belgeler-raporlar/2-Araştırma Raporu Ekleri .pdf",
      "googleDriveLink": "https://drive.google.com/file/d/1SiiCBUWA_G1LV7KiVRPBg6SNeLjdC_P9/view?usp=share_link",
      "isOptimized": false
    },
    {
      "id": "b3",
      "title": "EGM Mülkiye Müfetişleri Disiplin Raporu",
      "filename": "Disiplin Raporu .pdf",
      "description": "Olayla ilgili disiplin soruşturması raporu. Tarih: 26.02.2016",
      "category": "Disiplin",
      "date": "2016-02-26",
      "size": "28MB",
      "localPath": "/belgeler-raporlar/Disiplin Raporu .pdf",
      "googleDriveLink": "https://drive.google.com/file/d/1R3iJa943z-mBAeaXkZGlYgk1feyq_U5G/view?usp=share_link",
      "isOptimized": false
    },
    {
      "id": "b4",
      "title": "EGM Mülkiye Müfetişleri İnceleme Raporu",
      "filename": "İnceleme Raporu .pdf",
      "description": "Olayın detaylı inceleme raporu ve bulguları. Tarih: 13.10.2015",
      "category": "İnceleme",
      "date": "2015-10-13",
      "size": "184KB",
      "localPath": "/belgeler-raporlar/İnceleme Raporu .pdf",
      "googleDriveLink": "https://drive.google.com/file/d/1JnhibVNOyasfmUK3y_KgutGamfgA1626/view?usp=share_link",
      "isOptimized": false
    },
    {
      "id": "b5",
      "title": "EGM Mülkiye Müfetişleri İnceleme Raporu (2016)",
      "filename": "İnceleme Raporu.pdf",
      "description": "İnceleme raporunun 2016 tarihli versiyonu. Tarih: 26.02.2016",
      "category": "İnceleme",
      "date": "2016-02-26",
      "size": "2.1MB",
      "localPath": "/belgeler-raporlar/İnceleme Raporu.pdf",
      "googleDriveLink": "https://drive.google.com/file/d/1v_L0xV3CFBgJt2Mn9c9qrpPjirX8pRkc/view?usp=share_link",
      "isOptimized": false
    },
    {
      "id": "b6",
      "title": "EGM Mülkiye Müfettişleri Ön İnceleme Raporu",
      "filename": "MÜLKİYE MÜFETTİŞLERİ ÖN İNCELEME RAPORU.pdf",
      "description": "Mülkiye müfettişleri tarafından hazırlanan ön inceleme raporu. Tarih: 25.02.2016",
      "category": "Müfettişlik",
      "date": "2016-02-25",
      "size": "12MB",
      "localPath": "/belgeler-raporlar/MÜLKİYE MÜFETTİŞLERİ ÖN İNCELEME RAPORU.pdf",
      "googleDriveLink": "https://drive.google.com/file/d/1gl2G6KnXFHzDF20EFTW5-wZ21qCJoxAL/view?usp=share_link",
      "isOptimized": false
    },
    {
      "id": "b7",
      "title": "10 Ekim Raporu (Avukatlar)",
      "filename": "10-EKİM-RAPORU (avukatlar).pdf",
      "description": "10 Ekim davasına ilişkin avukatlar raporu.",
      "category": "Rapor",
      "date": "2016",
      "size": "5.4MB",
      "localPath": "/belgeler-raporlar/10-EKİM-RAPORU (avukatlar).pdf",
      "googleDriveLink": "https://drive.google.com/file/d/1pYY7GTRhBRWC_a8cbXdmStqi5QPGt-SM/view?usp=share_link",
      "isOptimized": false
    },
    {
      "id": "b8",
      "title": "Hukuki Mütalaa (Dr. Barış Işık)",
      "filename": "HUKUKİ MÜTALAA Dr. Barış IŞIK.pdf",
      "description": "10 Ekim dosyasına ilişkin hukuki mütalaa (Dr. Barış Işık).",
      "category": "Mütalaa",
      "date": "2016",
      "size": "192KB",
      "localPath": "/belgeler-raporlar/HUKUKİ MÜTALAA Dr. Barış IŞIK.pdf",
      "googleDriveLink": "https://docs.google.com/document/d/1DgT9mUVp2iwjKgCuFTronqJrzmvKut8O/edit?usp=share_link&ouid=110959319285380709547&rtpof=true&sd=true",
      "isOptimized": false
    },
    {
      "id": "b9",
      "title": "TTB 10 Ekim Raporu",
      "filename": "TTB 10 ekim rapor.pdf",
      "description": "Türk Tabipleri Birliği tarafından hazırlanan 10 Ekim raporu.",
      "category": "Rapor",
      "date": "2016",
      "size": "6.6MB",
      "localPath": "/belgeler-raporlar/TTB 10 ekim rapor.pdf",
      "googleDriveLink": "https://drive.google.com/file/d/1zZZncq89dPt0C8I6P1U-CeaD78iP35W4/view?usp=share_link",
      "isOptimized": false
    },
    {
      "id": "b10",
      "title": "ÖHD Raporu",
      "filename": "ÖHD RAPOR.pdf",
      "description": "Özgür Hukukçular Derneği tarafından hazırlanan rapor.",
      "category": "Rapor",
      "date": "2016",
      "size": "192KB",
      "localPath": "/belgeler-raporlar/ÖHD RAPOR.pdf",
      "googleDriveLink": "https://docs.google.com/document/d/1GfaPsYJLFvMVV2pn9U5_pnhlhwmymrE6/edit?usp=share_link&ouid=110959319285380709547&rtpof=true&sd=true",
      "isOptimized": false
    },
    {
      "id": "b11",
      "title": "İnsanlığa Karşı Suç Hukuki Mütalaa (Dr. Murat Önok)",
      "filename": "İNSANLIĞA KARŞI SUÇ HUKUKİ MÜTALAA DR. MURAT ÖNOK.pdf",
      "description": "İnsanlığa karşı suç kapsamında hukuki mütalaa (Dr. Murat Önok).",
      "category": "Mütalaa",
      "date": "2016",
      "size": "4.0MB",
      "localPath": "/belgeler-raporlar/İNSANLIĞA KARŞI SUÇ HUKUKİ MÜTALAA DR. MURAT ÖNOK.pdf",
      "googleDriveLink": "https://drive.google.com/file/d/17u1Tu_Vl3_RL3lBhb71BJo7IdcjUXmNS/view?usp=share_link",
      "isOptimized": false
    }
  ],
  "basin_aciklamalari": [
    {
      "id": "a1",
      "title": "Tefrik Karar Açıklaması",
      "filename": "03.07.2024-Tefrik Karar açıklaması.pdf",
      "description": "Tefrik kararı ile ilgili basın açıklaması.",
      "category": "Tefrik",
      "date": "2024-07-03",
      "sortDate": "2024-07-03",
      "size": "180KB",
      "localPath": "/basın açıklamaları/03.07.2024-Tefrik Karar açıklaması.pdf",
      "googleDriveLink": "https://docs.google.com/document/d/1QHPnmPlaCUs4ZZfhQKKvsaF4m3GPMgGm/edit?usp=share_link&ouid=110959319285380709547&rtpof=true&sd=true",
      "isOptimized": false
    },
    {
      "id": "a2",
      "title": "Tefrik Gerekçeli Karar Açıklaması",
      "filename": "13.09.2024-Tefrik Gerekçeli karar açıklaması.pdf",
      "description": "Tefrik gerekçeli karar ile ilgili basın açıklaması.",
      "category": "Tefrik",
      "date": "2024-09-13",
      "sortDate": "2024-09-13",
      "size": "168KB",
      "localPath": "/basın açıklamaları/13.09.2024-Tefrik Gerekçeli karar açıklaması.pdf",
      "googleDriveLink": "https://docs.google.com/document/d/1TYcOr9_CXmmkhJYQE445ZrYaISlL3WxW/edit?usp=share_link&ouid=110959319285380709547&rtpof=true&sd=true",
      "isOptimized": false
    },
    {
      "id": "a3",
      "title": "9. Yıl Anma Açıklaması",
      "filename": "10.10.2024-9.YIL ANMA açıklama.pdf",
      "description": "10 Ekim Ankara Gar Katliamı'nın 9. yılı anma açıklaması.",
      "category": "Anma",
      "date": "2024-10-10",
      "sortDate": "2024-10-10",
      "size": "168KB",
      "localPath": "/basın açıklamaları/10.10.2024-9.YIL ANMA açıklama.pdf",
      "googleDriveLink": "https://docs.google.com/document/d/1w8jmTR17dulRlyRk_NqTDklTZonEwpz-/edit?usp=share_link&ouid=110959319285380709547&rtpof=true&sd=true",
      "isOptimized": false
    },
    {
      "id": "a4",
      "title": "AYM Kabul Edilmezlik Açıklaması",
      "filename": "21.05.2024-AYM Kabul edilmezlik Açıklama.pdf",
      "description": "Anayasa Mahkemesi kabul edilmezlik kararı açıklaması.",
      "category": "AYM",
      "date": "2024-05-21",
      "sortDate": "2024-05-21",
      "size": "188KB",
      "localPath": "/basın açıklamaları/21.05.2024-AYM Kabul edilmezlik Açıklama.pdf",
      "googleDriveLink": "https://docs.google.com/document/d/1Lep60QKWRX4RgnlnPy50N2VI1GZOLG1y/edit?usp=share_link&ouid=110959319285380709547&rtpof=true&sd=true",
      "isOptimized": false
    },
    {
      "id": "a5",
      "title": "Tefrik Mütalaa Açıklaması",
      "filename": "24.04.2024- Tefrik Mütalaa açıklama.pdf",
      "description": "Tefrik mütalaa ile ilgili basın açıklaması.",
      "category": "Tefrik",
      "date": "2024-04-24",
      "sortDate": "2024-04-24",
      "size": "172KB",
      "localPath": "/basın açıklamaları/24.04.2024- Tefrik Mütalaa açıklama.pdf",
      "googleDriveLink": "https://docs.google.com/document/d/1gDubpgTE771vLoWGUVhPE7KjbuNBekTk/edit?usp=share_link&ouid=110959319285380709547&rtpof=true&sd=true",
      "isOptimized": false
    },
    {
      "id": "a6",
      "title": "Ankara Emniyet Kayıp Klasörler Suç Duyurusu Açıklaması",
      "filename": "23.11.2022- Ankara Emniyet-kayıp klasörler suç duyurusu açıklaması.pdf",
      "description": "Ankara Emniyet'te kayıp klasörler ile ilgili suç duyurusu açıklaması.",
      "category": "Suç Duyurusu",
      "date": "2022-11-23",
      "sortDate": "2022-11-23",
      "size": "188KB",
      "localPath": "/basın açıklamaları/23.11.2022- Ankara Emniyet-kayıp klasörler suç duyurusu açıklaması.pdf",
      "googleDriveLink": "https://docs.google.com/document/d/1jkpMD5Bl04gL4hxgWLnPcarfZVTwQcFv/edit?usp=share_link&ouid=110959319285380709547&rtpof=true&sd=true",
      "isOptimized": false
    },
    {
      "id": "a7",
      "title": "7. Yıl Anma Açıklaması",
      "filename": "10.10.2022-7.Yıl Anma Açıklama.pdf",
      "description": "10 Ekim Ankara Gar Katliamı'nın 7. yılı anma açıklaması.",
      "category": "Anma",
      "date": "2022-10-10",
      "sortDate": "2022-10-10",
      "size": "148KB",
      "localPath": "/basın açıklamaları/10.10.2022-7.Yıl Anma Açıklama.pdf",
      "googleDriveLink": "https://docs.google.com/document/d/1ceX-kKAzZA0yGJo0BOD-_cHWXfIZ2cVX/edit?usp=share_link&ouid=110959319285380709547&rtpof=true&sd=true",
      "isOptimized": false
    },
    {
      "id": "a8",
      "title": "7. Yıl Raporu - Adaleti Aratmamak",
      "filename": "06.10.2022-7.YIL raporu-ADALETİ ARATMAMAK.pdf",
      "description": "7. yıl raporu: Adaleti Aratmamak başlıklı açıklama.",
      "category": "Rapor",
      "date": "2022-10-06",
      "sortDate": "2022-10-06",
      "size": "236KB",
      "localPath": "/basın açıklamaları/06.10.2022-7.YIL raporu-ADALETİ ARATMAMAK.pdf",
      "googleDriveLink": "https://docs.google.com/document/d/1vpTQEFn9UWlvGNkaArJfAr8ahRFT0Rht/edit?usp=share_link&ouid=110959319285380709547&rtpof=true&sd=true",
      "isOptimized": false
    },
    {
      "id": "a9",
      "title": "Ümit Özdağ Açıklaması",
      "filename": "09.05.2022-ÜMİT ÖZDAĞ AÇIKLAMA.pdf",
      "description": "Ümit Özdağ ile ilgili basın açıklaması.",
      "category": "Kişisel",
      "date": "2022-05-09",
      "sortDate": "2022-05-09",
      "size": "32KB",
      "localPath": "/basın açıklamaları/09.05.2022-ÜMİT ÖZDAĞ AÇIKLAMA.pdf",
      "googleDriveLink": "https://docs.google.com/document/d/1Xrg6Si-fQOlbIdSYs-DZ9T5_dhKZVNhg/edit?usp=share_link&ouid=110959319285380709547&rtpof=true&sd=true",
      "isOptimized": false
    },
    {
      "id": "a10",
      "title": "Ümit Özdağ Suç Duyurusu Açıklaması",
      "filename": "05.07.2022-Ümit Özdağ Suç Duyurusu Açıklama.pdf",
      "description": "Ümit Özdağ ile ilgili suç duyurusu açıklaması.",
      "category": "Suç Duyurusu",
      "date": "2022-07-05",
      "sortDate": "2022-07-05",
      "size": "68KB",
      "localPath": "/basın açıklamaları/05.07.2022-Ümit Özdağ Suç Duyurusu Açıklama.pdf",
      "googleDriveLink": "https://docs.google.com/document/d/1tdFsyVJqCbRcaQz9wtKicJDU_iBVZ58y/edit?usp=share_link&ouid=110959319285380709547&rtpof=true&sd=true",
      "isOptimized": false
    },
    {
      "id": "a11",
      "title": "İDDK Kararı Açıklaması",
      "filename": "17.01.2023-iddk kararı açıklama.pdf",
      "description": "İdari Dava Daireleri Kurulu kararı açıklaması.",
      "category": "İdari",
      "date": "2023-01-17",
      "sortDate": "2023-01-17",
      "size": "48KB",
      "localPath": "/basın açıklamaları/17.01.2023-iddk kararı açıklama.pdf",
      "googleDriveLink": "https://docs.google.com/document/d/1KUTXKIrdfbNnWBT0aJn1LjFWGfrkcv4a/edit?usp=share_link&ouid=110959319285380709547&rtpof=true&sd=true",
      "isOptimized": false
    },
    {
      "id": "a12",
      "title": "Yargıtay Tebliğname Açıklaması",
      "filename": "06.04.2021- Yargıtay tebliğname açıklama.pdf",
      "description": "Yargıtay tebliğname ile ilgili basın açıklaması.",
      "category": "Yargıtay",
      "date": "2021-04-06",
      "sortDate": "2021-04-06",
      "size": "84KB",
      "localPath": "/basın açıklamaları/06.04.2021- Yargıtay tebliğname açıklama.pdf",
      "googleDriveLink": "https://docs.google.com/document/d/1a_ZOcv-QC0DApIBLs3ApG6jmFXnGBntX/edit?usp=share_link&ouid=110959319285380709547&rtpof=true&sd=true",
      "isOptimized": false
    },
    {
      "id": "a13",
      "title": "Yakalanan IŞİD'liler Açıklaması",
      "filename": "22.09.2021-YAKALANAN IŞİDLİLER.pdf",
      "description": "Yakalanan IŞİD'liler ile ilgili basın açıklaması.",
      "category": "Güvenlik",
      "date": "2021-09-22",
      "sortDate": "2021-09-22",
      "size": "148KB",
      "localPath": "/basın açıklamaları/22.09.2021-YAKALANAN IŞİDLİLER.pdf",
      "googleDriveLink": "https://docs.google.com/document/d/1qx6BvvidK-sK28N9yuQnkkspUbzBkX49/edit?usp=share_link&ouid=110959319285380709547&rtpof=true&sd=true",
      "isOptimized": false
    },
    {
      "id": "a14",
      "title": "Adalete Açık Çağrı",
      "filename": "22.11.2021-Adalete Açık Çağrı.pdf",
      "description": "Adalete açık çağrı başlıklı basın açıklaması.",
      "category": "Genel",
      "date": "2021-11-22",
      "sortDate": "2021-11-22",
      "size": "116KB",
      "localPath": "/basın açıklamaları/22.11.2021-Adalete Açık Çağrı.pdf",
      "googleDriveLink": "https://docs.google.com/document/d/1ApyTNiLmTPRrjWsWh4V0Tr_efoVjsWXF/edit?usp=share_link&ouid=110959319285380709547&rtpof=true&sd=true",
      "isOptimized": false
    },
    {
      "id": "a15",
      "title": "Savcılar AYM Başvuru Açıklaması",
      "filename": "26.11.2021-savcılar aym başvuru açıklama.pdf",
      "description": "Savcıların AYM başvurusu ile ilgili açıklama.",
      "category": "AYM",
      "date": "2021-11-26",
      "sortDate": "2021-11-26",
      "size": "100KB",
      "localPath": "/basın açıklamaları/26.11.2021-savcılar aym başvuru açıklama.pdf",
      "googleDriveLink": "https://docs.google.com/document/d/1Z85KcZZmllYkuvjLZsoi_nUkMY4MD-Un/edit?usp=share_link&ouid=110959319285380709547&rtpof=true&sd=true",
      "isOptimized": false
    },
    {
      "id": "a16",
      "title": "Danıştay Kararı Açıklaması",
      "filename": "10.08.2021-Danıştay Kararı Açıklama.pdf",
      "description": "Danıştay kararı ile ilgili basın açıklaması.",
      "category": "Danıştay",
      "date": "2021-08-10",
      "sortDate": "2021-08-10",
      "size": "100KB",
      "localPath": "/basın açıklamaları/10.08.2021-Danıştay Kararı Açıklama.pdf",
      "googleDriveLink": "https://docs.google.com/document/d/1ZkES49IQh0IErq44Kc_lfAHQfEvOm_CU/edit?usp=share_link&ouid=110959319285380709547&rtpof=true&sd=true",
      "isOptimized": false
    },
    {
      "id": "a17",
      "title": "Antep Emniyeti Suç Duyurusu",
      "filename": "27.01.2021- Antep Emniyeti Suç Duyurusu.pdf",
      "description": "Antep Emniyeti ile ilgili suç duyurusu açıklaması.",
      "category": "Suç Duyurusu",
      "date": "2021-01-27",
      "sortDate": "2021-01-27",
      "size": "60KB",
      "localPath": "/basın açıklamaları/27.01.2021- Antep Emniyeti Suç Duyurusu.pdf",
      "googleDriveLink": "https://docs.google.com/document/d/1koSJQ54BVKj2BQzU-mwOPRHS-xFCX5PS/edit?usp=share_link&ouid=110959319285380709547&rtpof=true&sd=true",
      "isOptimized": false
    },
    {
      "id": "a18",
      "title": "Hulusi Akar Açıklamalarına İlişkin",
      "filename": "14.11.2020- Hulusi Akar açıklamalarına ilişkin.pdf",
      "description": "Hulusi Akar'ın açıklamalarına ilişkin basın açıklaması.",
      "category": "Kişisel",
      "date": "2020-11-14",
      "sortDate": "2020-11-14",
      "size": "64KB",
      "localPath": "/basın açıklamaları/14.11.2020- Hulusi Akar açıklamalarına ilişkin.pdf",
      "googleDriveLink": "https://docs.google.com/document/d/1cpE713QQFAzBy0useWJsgBE8YLrTdqPS/edit?usp=share_link&ouid=110959319285380709547&rtpof=true&sd=true",
      "isOptimized": false
    },
    {
      "id": "a19",
      "title": "Heyet Değişikliği Açıklaması",
      "filename": "29.12.2020-heyet değişikliği açıklama.pdf",
      "description": "Heyet değişikliği ile ilgili basın açıklaması.",
      "category": "Genel",
      "date": "2020-12-29",
      "sortDate": "2020-12-29",
      "size": "68KB",
      "localPath": "/basın açıklamaları/29.12.2020-heyet değişikliği açıklama.pdf",
      "googleDriveLink": "https://docs.google.com/document/d/1T7lmTCt2HGyHur4wSSEjMNbVRTqXqXlS/edit?usp=share_link&ouid=110959319285380709547&rtpof=true&sd=true",
      "isOptimized": false
    },
    {
      "id": "a20",
      "title": "Adem Arslanoğlu Açıklaması",
      "filename": "15.08.2020-adem arslanoğlu açıklama.pdf",
      "description": "Adem Arslanoğlu ile ilgili basın açıklaması.",
      "category": "Kişisel",
      "date": "2020-08-15",
      "sortDate": "2020-08-15",
      "size": "60KB",
      "localPath": "/basın açıklamaları/15.08.2020-adem arslanoğlu açıklama.pdf",
      "googleDriveLink": "https://docs.google.com/document/d/1jTnm9VoAUBXnH-v0vJCm4YtkoD4EOGFr/edit?usp=share_link&ouid=110959319285380709547&rtpof=true&sd=true",
      "isOptimized": false
    },
    {
      "id": "a21",
      "title": "Davutoğlu Açıklaması",
      "filename": "15.06.2020- Davutoğlu açıklama.pdf",
      "description": "Davutoğlu ile ilgili basın açıklaması.",
      "category": "Kişisel",
      "date": "2020-06-15",
      "sortDate": "2020-06-15",
      "size": "76KB",
      "localPath": "/basın açıklamaları/15.06.2020- Davutoğlu açıklama.pdf",
      "googleDriveLink": "https://docs.google.com/document/d/1eF74sAYSXaV2u6SvbOHh-ch-W9dLJU66/edit?usp=share_link&ouid=110959319285380709547&rtpof=true&sd=true",
      "isOptimized": false
    },
    {
      "id": "a22",
      "title": "İlhami Balı Açıklaması",
      "filename": "13.09.2019-İlhami Balı Açıklama.pdf",
      "description": "İlhami Balı ile ilgili basın açıklaması.",
      "category": "Kişisel",
      "date": "2019-09-13",
      "sortDate": "2019-09-13",
      "size": "88KB",
      "localPath": "/basın açıklamaları/13.09.2019-İlhami Balı Açıklama.pdf",
      "googleDriveLink": "https://docs.google.com/document/d/1edog_knSrlaeQZbMzvo9QRPrvdFiLo_Y/edit?usp=share_link&ouid=110959319285380709547&rtpof=true&sd=true",
      "isOptimized": false
    },
    {
      "id": "a23",
      "title": "Gerekçeli Karar Açıklaması",
      "filename": "22.02.2019-Gerekçeli karar açıklama.pdf",
      "description": "Gerekçeli karar ile ilgili basın açıklaması.",
      "category": "Genel",
      "date": "2019-02-22",
      "sortDate": "2019-02-22",
      "size": "68KB",
      "localPath": "/basın açıklamaları/22.02.2019-Gerekçeli karar açıklama.pdf",
      "googleDriveLink": "https://docs.google.com/document/d/1IJuX-sIKcQzvHv-QmKLn-aZgXrhp4Sey/edit?usp=share_link&ouid=110959319285380709547&rtpof=true&sd=true",
      "isOptimized": false
    },
    {
      "id": "a24",
      "title": "Ana Dava Mütalaa Açıklaması",
      "filename": "18.06.2018-Ana Dava Mütalaa Açıklama.pdf",
      "description": "Ana dava mütalaa ile ilgili basın açıklaması.",
      "category": "Dava",
      "date": "2018-06-18",
      "sortDate": "2018-06-18",
      "size": "100KB",
      "localPath": "/basın açıklamaları/18.06.2018-Ana Dava Mütalaa Açıklama.pdf",
      "googleDriveLink": "https://docs.google.com/document/d/1W4cv2USQPgXkiFJ7GgTwTzfY85OgIwik/edit?usp=share_link&ouid=110959319285380709547&rtpof=true&sd=true",
      "isOptimized": false
    },
    {
      "id": "a25",
      "title": "Kısıtlılık AYM Kararı Açıklaması",
      "filename": "07.12.2018- Kısıtlılık AYM kararı açıklama.pdf",
      "description": "Kısıtlılık AYM kararı ile ilgili basın açıklaması.",
      "category": "AYM",
      "date": "2018-12-07",
      "sortDate": "2018-12-07",
      "size": "56KB",
      "localPath": "/basın açıklamaları/07.12.2018- Kısıtlılık AYM kararı açıklama.pdf",
      "googleDriveLink": "https://docs.google.com/document/d/1zzS9hXNNaW5jA7jVo9n08U1jGpnsP46R/edit?usp=share_link&ouid=110959319285380709547&rtpof=true&sd=true",
      "isOptimized": false
    }
  ],
  "metadata": {
    "totalFiles": 40,
    "totalSize": "250MB",
    "lastUpdated": "2024-12-19",
    "version": "1.0",
    "categories": {
      "kararlar": ["Mahkeme Kararı", "Dava Belgesi"],
      "belgeler_raporlar": ["Araştırma", "Disiplin", "İnceleme", "Müfettişlik", "Rapor", "Mütalaa"],
      "basin_aciklamalari": ["Tefrik", "Anma", "AYM", "Suç Duyurusu", "Yargıtay", "Danıştay", "İdari", "Güvenlik", "Dava", "Rapor", "Kişisel", "Genel"]
    }
  }
}
